[
  {
    "analysis_method": "gemini:gemini-3.5-flash-lite",
    "confidence": "high",
    "explanation": "Công cụ cảnh báo mã nguồn có thể đang sử dụng hàm mở URL với các scheme chưa được kiểm soát chặt chẽ, dẫn đến khả năng xảy ra yêu cầu phía máy chủ nếu đầu vào thay đổi được.",
    "id": "bandit:B310",
    "knowledge_ids": [
      "ssrf"
    ],
    "locations": [
      {
        "file_or_url": "scripts/run_all_tests.py",
        "line": 43,
        "method": null
      },
      {
        "file_or_url": "scripts/verify_gateway.py",
        "line": 50,
        "method": null
      }
    ],
    "name": "B310: Audit url open for permitted schemes. Allowing use of file:/ or custom schemes is often unexpected.",
    "occurrence_count": 2,
    "remediation_steps": [
      "Áp dụng danh sách cho phép (allowlist) đối với các scheme URL được phép sử dụng.",
      "Tránh cho phép các scheme tùy chỉnh hoặc truy cập file cục bộ trừ khi thực sự cần thiết."
    ],
    "scanner_evidence": [
      {
        "evidence": "49     try:\n50         response = urlopen(request, timeout=REQUEST_TIMEOUT_SECONDS)\n51     except HTTPError as error:",
        "finding_id": "bandit-4f8d23dbe29b8c35",
        "rule_id": "B310",
        "source_file": "security-results/bandit-baseline.json",
        "tool": "bandit"
      },
      {
        "evidence": "42         try:\n43             with urlopen(\"http://localhost:8080/health\", timeout=2) as response:\n44                 if response.status == 200:",
        "finding_id": "bandit-c38035a2a6e76870",
        "rule_id": "B310",
        "source_file": "security-results/bandit-baseline.json",
        "tool": "bandit"
      }
    ],
    "schema_version": "1.0",
    "severity": "medium",
    "source_finding_ids": [
      "bandit-4f8d23dbe29b8c35",
      "bandit-c38035a2a6e76870"
    ],
    "verification_steps": [
      "Kiểm tra xem các tham số truyền vào hàm mở URL có nguồn gốc từ người dùng hay không.",
      "Đảm bảo các scheme bị giới hạn nghiêm ngặt ở các giá trị an toàn."
    ]
  },
  {
    "analysis_method": "gemini:gemini-3.5-flash-lite",
    "confidence": "high",
    "explanation": "Công cụ phát hiện việc sử dụng câu lệnh assert trong mã nguồn, có thể bị loại bỏ khi biên dịch mã bytecode tối ưu.",
    "id": "bandit:B101",
    "knowledge_ids": [],
    "locations": [
      {
        "file_or_url": "scripts/verify_gateway.py",
        "line": 91,
        "method": null
      },
      {
        "file_or_url": "scripts/verify_gateway.py",
        "line": 92,
        "method": null
      },
      {
        "file_or_url": "scripts/verify_gateway.py",
        "line": 103,
        "method": null
      },
      {
        "file_or_url": "scripts/verify_gateway.py",
        "line": 104,
        "method": null
      },
      {
        "file_or_url": "scripts/verify_gateway.py",
        "line": 105,
        "method": null
      },
      {
        "file_or_url": "scripts/verify_gateway.py",
        "line": 108,
        "method": null
      },
      {
        "file_or_url": "scripts/verify_gateway.py",
        "line": 109,
        "method": null
      },
      {
        "file_or_url": "scripts/verify_gateway.py",
        "line": 114,
        "method": null
      },
      {
        "file_or_url": "scripts/verify_gateway.py",
        "line": 117,
        "method": null
      },
      {
        "file_or_url": "scripts/verify_gateway.py",
        "line": 118,
        "method": null
      },
      {
        "file_or_url": "scripts/verify_gateway.py",
        "line": 121,
        "method": null
      },
      {
        "file_or_url": "scripts/verify_gateway.py",
        "line": 124,
        "method": null
      },
      {
        "file_or_url": "scripts/verify_gateway.py",
        "line": 127,
        "method": null
      },
      {
        "file_or_url": "scripts/verify_gateway.py",
        "line": 130,
        "method": null
      }
    ],
    "name": "B101: Use of assert detected. The enclosed code will be removed when compiling to optimised byte code.",
    "occurrence_count": 14,
    "remediation_steps": [
      "Thay thế các câu lệnh assert bằng cơ chế kiểm tra điều kiện và xử lý ngoại lệ phù hợp cho logic nghiệp vụ."
    ],
    "scanner_evidence": [
      {
        "evidence": "113     status, _, _ = gateway_get(\"/api/users\")\n114     assert status == 401\n115",
        "finding_id": "bandit-01c202489557ad0a",
        "rule_id": "B101",
        "source_file": "security-results/bandit-baseline.json",
        "tool": "bandit"
      },
      {
        "evidence": "120     status, _, _ = gateway_get(\"/api/admin\", reader_token)\n121     assert status == 403\n122",
        "finding_id": "bandit-0f5d113967468ae0",
        "rule_id": "B101",
        "source_file": "security-results/bandit-baseline.json",
        "tool": "bandit"
      },
      {
        "evidence": "108     assert status == 200\n109     assert metadata[\"resource\"] == GATEWAY_URL\n110",
        "finding_id": "bandit-0fe1f8c346113bdd",
        "rule_id": "B101",
        "source_file": "security-results/bandit-baseline.json",
        "tool": "bandit"
      },
      {
        "evidence": "123     status, _, _ = gateway_get(\"/api/users\", admin_token)\n124     assert status == 200\n125",
        "finding_id": "bandit-1d33bedac188f31a",
        "rule_id": "B101",
        "source_file": "security-results/bandit-baseline.json",
        "tool": "bandit"
      },
      {
        "evidence": "126     status, _, _ = gateway_get(\"/api/admin\", admin_token)\n127     assert status == 200\n128",
        "finding_id": "bandit-31ec2b93cf2dcb5d",
        "rule_id": "B101",
        "source_file": "security-results/bandit-baseline.json",
        "tool": "bandit"
      },
      {
        "evidence": "116     status, users, _ = gateway_get(\"/api/users\", reader_token)\n117     assert status == 200\n118     assert len(users) == 2",
        "finding_id": "bandit-36b2e529a9f8a7e7",
        "rule_id": "B101",
        "source_file": "security-results/bandit-baseline.json",
        "tool": "bandit"
      },
      {
        "evidence": "102     status, body, request_id = gateway_get(\"/health\")\n103     assert status == 200\n104     assert body == {\"status\": \"ok\"}",
        "finding_id": "bandit-6eff1f04be22c443",
        "rule_id": "B101",
        "source_file": "security-results/bandit-baseline.json",
        "tool": "bandit"
      },
      {
        "evidence": "90     )\n91     assert status == 200, f\"Token request for {client_id} failed with HTTP {status}\"\n92     assert isinstance(body, dict) and isinstance(body.get(\"access_token\"), str)",
        "finding_id": "bandit-8496bdfdf26647f3",
        "rule_id": "B101",
        "source_file": "security-results/bandit-baseline.json",
        "tool": "bandit"
      },
      {
        "evidence": "107     status, metadata, _ = gateway_get(\"/.well-known/oauth-protected-resource\")\n108     assert status == 200\n109     assert metadata[\"resource\"] == GATEWAY_URL",
        "finding_id": "bandit-a10332086330974c",
        "rule_id": "B101",
        "source_file": "security-results/bandit-baseline.json",
        "tool": "bandit"
      },
      {
        "evidence": "91     assert status == 200, f\"Token request for {client_id} failed with HTTP {status}\"\n92     assert isinstance(body, dict) and isinstance(body.get(\"access_token\"), str)\n93     return body[\"access_token\"]",
        "finding_id": "bandit-aa3399dafdc5109d",
        "rule_id": "B101",
        "source_file": "security-results/bandit-baseline.json",
        "tool": "bandit"
      },
      {
        "evidence": "103     assert status == 200\n104     assert body == {\"status\": \"ok\"}\n105     assert request_id",
        "finding_id": "bandit-cb741289c048ae77",
        "rule_id": "B101",
        "source_file": "security-results/bandit-baseline.json",
        "tool": "bandit"
      },
      {
        "evidence": "104     assert body == {\"status\": \"ok\"}\n105     assert request_id\n106",
        "finding_id": "bandit-d2f4af3de909b4dc",
        "rule_id": "B101",
        "source_file": "security-results/bandit-baseline.json",
        "tool": "bandit"
      },
      {
        "evidence": "117     assert status == 200\n118     assert len(users) == 2\n119",
        "finding_id": "bandit-e5516d22040ac134",
        "rule_id": "B101",
        "source_file": "security-results/bandit-baseline.json",
        "tool": "bandit"
      },
      {
        "evidence": "129     status, _, _ = gateway_get(\"/api/unlisted\", admin_token)\n130     assert status == 403\n131",
        "finding_id": "bandit-e881367bcf4a2fe3",
        "rule_id": "B101",
        "source_file": "security-results/bandit-baseline.json",
        "tool": "bandit"
      }
    ],
    "schema_version": "1.0",
    "severity": "low",
    "source_finding_ids": [
      "bandit-01c202489557ad0a",
      "bandit-0f5d113967468ae0",
      "bandit-0fe1f8c346113bdd",
      "bandit-1d33bedac188f31a",
      "bandit-31ec2b93cf2dcb5d",
      "bandit-36b2e529a9f8a7e7",
      "bandit-6eff1f04be22c443",
      "bandit-8496bdfdf26647f3",
      "bandit-a10332086330974c",
      "bandit-aa3399dafdc5109d",
      "bandit-cb741289c048ae77",
      "bandit-d2f4af3de909b4dc",
      "bandit-e5516d22040ac134",
      "bandit-e881367bcf4a2fe3"
    ],
    "verification_steps": [
      "Kiểm tra xem mã nguồn có được dùng cho môi trường production với cờ tối ưu hóa hay không.",
      "Xác định vị trí các câu lệnh assert trong logic kiểm tra chính."
    ]
  },
  {
    "analysis_method": "gemini:gemini-3.5-flash-lite",
    "confidence": "medium",
    "explanation": "Công cụ cảnh báo có thể có chuỗi thông tin nhạy cảm hoặc mật khẩu được gán cứng trong mã nguồn.",
    "id": "bandit:B105",
    "knowledge_ids": [
      "authentication-failures"
    ],
    "locations": [
      {
        "file_or_url": "scripts/verify_gateway.py",
        "line": 16,
        "method": null
      }
    ],